{
  "captured_at": "2026-04-18T15:58:36Z",
  "corpus": "openai_1k_d768",
  "git_commit": "cfe519f",
  "host": {
    "arch": "x86_64",
    "cpu_model": "13th Gen Intel(R) Core(TM) i5-1340P",
    "os": "windows",
    "rustc": "rustc 1.81.0 (eeb90cda1 2024-09-04)"
  },
  "results": {
    "bw2_no_residual": {
      "ratio": 16.0,
      "recall_at_10": 0.353,
      "rho": 0.511935
    },
    "bw2_residual": {
      "ratio": 1.777778,
      "recall_at_10": 1.0,
      "rho": 1.0
    },
    "bw4_no_residual": {
      "ratio": 8.0,
      "recall_at_10": 0.791,
      "rho": 0.957252
    },
    "bw4_residual": {
      "ratio": 1.6,
      "recall_at_10": 1.0,
      "rho": 1.0
    },
    "bw8_residual": {
      "ratio": 1.333333,
      "recall_at_10": 1.0,
      "rho": 1.0
    }
  },
  "schema_version": 1,
  "seed": 42
}
